,Sr. No.,Date (dd/mm/yyyy),Startup Name,Industry/ Vertical,Sub-Vertical,City / Location,Investors’ Name,Investment Type,Amount (in USD)
0,1,01/08/2015,Snapdeal,Ecommerce Marketplace,New Delhi,"Alibaba, Foxconn, Softbank",Private Equity,"500,000,000",Late Stage Round 7th (More details)
1,2,01/08/2015,Ressy,Restaurant Discount app,Pune,Mohandas Pai & others,Seed Funding,"400,000",
2,3,03/08/2015,Cuelearn,Tech-enabled learning,New Delhi,Alok Mittal,Seed Funding,N/A,
3,4,03/08/2015,Connect India,ECommerce Logistics provider,New Delhi,Aavishkaar,Private Equity,"5,000,000",Series A
4,5,03/08/2015,The Home Salon,on-demand home beauty and wellness portal,Mumbai,VentureNursery,Seed Funding,N/A,
5,6,03/08/2015,Jusride,Self Driven Car rental,Mumbai,"Alok Mittal, Zeeshan Hayat, Niraj Singh, Nikunj Jain, Anirudh Damani, Punit Goyal",Seed Funding,N/A,
6,7,03/08/2015,Oyorooms,Budget Hotel accommodation brand,New Delhi,"SoftBank Group, Greenoaks Capital, Sequoia Capital,  Lightspeed India",Private Equity,"100,000,000",Series B
7,8,03/08/2015,Glowship,Energy & Environment Online Marketplace,Bangalore,Infuse Ventures,Seed Funding,N/A,
8,9,03/08/2015,Wizrocket,User Engagment & Analytics platform,Mumbai,"Sequoia Capital, Accel Partners",Private Equity,"9,600,000",Series B
9,10,04/08/2015,Pickingo,On-Demand Delivery Logistics,New Delhi,"Orios Venture Partners, Zishaan Hayath",Private Equity,"1,300,000",Series A
10,11,05/08/2015,Grex,fund raising platform for startups,Pune,"Kunal Bajaj, Chandru Badrinarayanan",Seed Funding,"650,000",
11,12,05/08/2015,LetsTransport,Logistics Tech Platform,Bangalore,"Rebright Partners, Ankush Nijhawan, Gaurav Bhatnagar, Manish Dhingra",Seed Funding,"1,300,000",
12,13,05/08/2015,Zo Rooms,Online budget hotel chain,New Delhi,"Tiger Global Management, Orios Venture Partners",Private Equity,"30,000,000",Series A
13,14,05/08/2015,Doormint,Hyperlocal Handyman services,Mumbai,"Helion Venture Partners, Kalaari Capital",Private Equity,"3,000,000",Series A
14,15,05/08/2015,NightStay,hotel booking app,Noida,"BedRock Ventures, Rajesh Sawhney, Shailesh Singh",Seed Funding,"500,000",
15,16,05/08/2015,Zocalo,Rental Accomodation finder,New Delhi,"Sachin Bhatia, Rajesh Sawhney",Seed Funding,N/A,
16,17,05/08/2015,Sunday Realty Solutions,Tech Platform for property brokers,Mumbai,"Ramesh Jogani, Shailesh Viswanathan, Jay Srinivasan",Seed Funding,"785,000",
17,18,06/08/2015,Klozee,Luxury Apparel rental,Bangalore,Tracxn Labs,Seed Funding,N/A,
18,19,06/08/2015,Appvigil,App security  testing platform,Mumbai,"Ravi Gururaj, Gaurav Sharma, Viswanath Ramachandran, RippleWave",Seed Funding,"500,000",pre Series-A
19,20,06/08/2015,practo,Doctor Appointment booking app,Bangalore,"Sofina, Google Capital, Altimeter Capital, Sequoia Capital Global Equities, Yuri Milner, Sequoia Capital, Matrix Partners",Private Equity,"90,000,000",Series C
20,21,06/08/2015,LoudShout,anonymous bulletin board app,New Delhi,"Sanjay Sethi, Ravi Jaipuria & others",Seed Funding,N/A,
21,22,06/08/2015,Wetravelsolo,Travel community platform,New Delhi,"CCube Angels, Frontline Strategy",Seed Funding,N/A,
22,23,06/08/2015,Ketto,Crowd funding platform,Mumbai,"Chennai Angels, Calcutta Angels, ah! Ventures, Intellecap Impact Investment Network, Indus Age Partners, Singapore Angel Network, India Internet Fund, LetsVenture",Seed Funding,"700,000",
23,23,06/08/2015,Ezetap,Mobile based PoS solution,Bangalore,"Horizons Ventures, Capricorn Investment Group, Social+Capital, Helion Advisors, Berggruen Holdings",Private Equity,"25,000,000",Series C
24,24,06/08/2015,NDTV ecommerce venture,Car & Bike ecommerce platform,Mumbai,"Inflexionpoint, Pramod Bhasin, Sixth Sense Ventures, Vindi Banga, Hiro Mashita",Private Equity,N/A,Series A
25,25,07/08/2015,Carl’s Jr,Fast food Chain Franchisee,Gurgaon,YouWeCan Ventures,Seed Funding,"630,000",
26,26,07/08/2015,EasyRewardz,Loyalty Programs & Reward Points,Mumbai,"Wealth First, Ashneer Grover, Atul Phadnis",Private Equity,"500,000",Pre-Series A
27,27,07/08/2015,GIBSS,Energy saving solutions provider,Mumbai,"responsAbility Investments, Infuse Ventures",Private Equity,N/A,Series A
28,28,07/08/2015,StoreMore.in,Self-Storage Spaces,Noida,Bedrock Ventures,Seed Funding,N/A,
29,29,07/08/2015,iOrderFresh,Grocery retail Mobile app,New Delhi,Best Foodworks,Seed Funding,N/A,
30,30,10/08/2015,MyTaxiIndia,Taxi Rental platform,Gurgaon,"Nihon Kotsu,",Private Equity,"500,000",Pre Series-A
31,31,10/08/2015,eSadar,ecommerce,New Delhi,"Neha Vats, Gaurav Vats",Seed Funding,"80,000",
32,32,10/08/2015,Actionable Analytics,Machine Learning Platform,New Delhi/ Houston,"B M Gupta, Vinod Singhal",Seed Funding,N/A,
33,33,10/08/2015,MyPoolin,mobile social network,New Delhi,QPrize from Qualcomm Ventures,Seed Funding,"250,000",QPrize Contest Winners
34,34,10/08/2015,NearBuy (previously  groupon India),Hyper-Local Ecommerce,New Delhi,Sequoia Capital,Private Equity,"16,000,000",Series A
35,35,10/08/2015,Inkmonk,Online printing marketplace,Chennai,"Girish Mathrubootham, Phanindra Sama, Vikram Chachra, Others from LetsVenture",Seed Funding,"250,000",
36,36,10/08/2015,ToneTag,mobile payment software platform,Bangalore,Reliance Capital Venture,Private Equity,"1,000,000",Series A
37,37,10/08/2015,Grey Orange,Automated Storage & Warehousing Solution,Gurgaon,Tiger Global Management,Private Equity,"30,000,000",Series B
38,38,11/08/2015,Livspace,Home Design & Décor solutions,Bangalore,"Helion Ventures, Jungle Ventures & Bessemer Venture Partners",Private Equity,"8,000,000",Series A
39,39,11/08/2015,WOW! MOMO,Quick Service Restaurant Chain,Kolkata,Indian Angel Network,Seed Funding,"1,600,000",
40,40,11/08/2015,RainCan,Subscription based Online Grocery platform,Pune,Ajeet Khurana & Others,Seed Funding,"100,000",
41,41,11/08/2015,Allygrow Technologies,engineering services company,Mumbai,Zodius Technology Fund,Private Equity,"20,000,000",Series A
42,42,11/08/2015,Infogain,Business and IT consulting,New Delhi / US,ChrysCapital,Private Equity,"63,000,000",N/A
43,43,12/08/2015,OneAssist,Credit Card Fraud protection solutions,Mumbai,"Sequoia Capital, Lightspeed Ventures",Private Equity,"7,500,000",Series B
44,44,12/08/2015,BigBasket,Online & mobile Grocery store,Bangalore,Bessemer Venture Partners,Private Equity,"50,000,000",Series C
45,45,12/08/2015,Sheroes,Career Community for Women,Noida,"Quintillion Media, 500 Startups",Seed Funding,"770,000",
46,46,12/08/2015,Scripbox,Mutual Fund Investing platform,Bangalore,"Accel Partners, Deep Kalra, Rajesh Magow, Mohit Gupta, Shamik Sharma",Private Equity,"2,500,000",Series A
47,47,13/08/2015,betaout,Ecommerce Marketing Software Platform,Noida,"Amit Ranjan, Vijay Shekhar Sharma, Kunal Bahl, Girish Mathrubootham &  Group of other Angel investors",Seed Funding,"500,000",
48,48,13/08/2015,IFMR Holdings,Financial Inclusion platform,Chennai,"Accion, LeapFrog Investments, Lok Capital",Private Equity,"25,000,000",Series B
49,49,13/08/2015,Massblurb,Digital Marketing automation solution,Mumbai,"LetsVenture, Mumbai Angels",Seed Funding,N/A,
50,50,13/08/2015,Agrostar,Mobile Commerce for Farmers,Pune,IDG Ventures,Private Equity,"4,000,000",Series A
51,51,14/08/2015,VoxWeb,Picture based Social App,Mumbai,Jitendra Gupta & others,Seed Funding,"100,000",
52,52,14/08/2015,Trukky,Logistics service platform,Ahmedabad,"Gujarat based angel investors, MMY co-Founder",Seed Funding,"245,000",
53,53,14/08/2015,VanityCube,On-Demand Beauty Services,New Delhi,Group of angel investors,Seed Funding,N/A,
54,54,17/08/2015,Edu4Share,Exam Preparation Platform,New Delhi,Nalin Jain & other angel investors,Seed Funding,"220,000",
55,55,17/08/2015,YourStory,Startup Focused Online Publisher,Mumbai,"Ratan Tata, Vani Kola, T V Mohandas Pai, Karthee Madasamay",Seed Funding,N/A,
56,56,17/08/2015,Sampurnearth,Waste Management Solutions,Mumbai,"Intellecap Impact Investment Network, family office fund",Seed Funding,"160,000",
57,57,17/08/2015,Orobind,App based Fitness coaching,Bangalore,Existing & New Investors,Private Equity,N/A,pre series A
58,58,17/08/2015,Fixy,On demand cleaning & fixing services,Mumbai,VentureNursery,Seed Funding,N/A,
59,59,17/08/2015,MSM Box,Beauty & Lifestyle platform,New Delhi,Rohit Goel,Seed Funding,N/A,
60,60,17/08/2015,ShadowFax,on-demand delivery service,Gurgaon,"Kunal Bahl, Rohit Bansal, Zishaan Hayath, Prashant Malik",Seed Funding,"310,000",
61,61,17/08/2015,Gadgets 360,Car & Bike ecommerce platform,New Delhi,One97 Communications,Private Equity,N/A,Strategic Investment
62,62,18/08/2015,Roposo,Fashion Discovery platform,Gurgaon,Tiger Global,Private Equity,"15,000,000",Series B
63,63,18/08/2015,IntelligenceNODE,Data Analytics Platform,Mumbai,"New Enterprise Associates, Orios Venture Partners",Private Equity,"4,200,000",Series A
64,64,18/08/2015,HyperVerge,Deep Learning Cloud Algorithms,Chennai,"NEA, Milliways Ventures, Naya Ventures",Seed Funding,"1,000,000",
65,65,18/08/2015,Twyst,Location based engagement & rewards platform,Gurgaon,"Rohit Bhatia, Sunil Nikhar, Vaibhav Domkundwar, Siddharth Nautiyal",Seed Funding,N/A,
66,66,18/08/2015,IDfy,Online Identity Verification Services platform,Mumbai,"NEA, Blume Ventures & others",Private Equity,N/A,Series A
67,67,18/08/2015,Zoojoo.be,Corporate Wellness App,Bangalore,RoundGlass Partners,Private Equity,"1,000,000",Series A
68,68,19/08/2015,Fashionove,Fashion Search & Review Platform,Kolkata,Umesh Yadav,Seed Funding,N/A,
69,69,19/08/2015,TimeSaverz,"Hyperlocal Maintenance, Repair & Cleaning services",Mumbai,Unilazer Ventures,Private Equity,"2,400,000",
70,70,19/08/2015,Envoged,pre-owned Luxury online apparel seller,Mumbai,"Manish Dhingra, Ankush Nijhawa, Gaurav Bhatnagar",Seed Funding,N/A,
71,71,19/08/2015,MebelKart,Online Furniture Marketplace,Bangalore,AskMe,Private Equity,"20,000,000",
72,72,20/08/2015,LabsAdvisor,Online Diagnostic Tests Marketplace,New Delhi,Group of Angel Investors,Seed Funding,"156,000",
73,73,20/08/2015,Flatpebble,Online marketplace for Photographers,Hyderabad,Indian Angel Network,Seed Funding,"600,000",
74,74,20/08/2015,Bluegape.com,Visual Blogging platform,New Delhi,"ah! Ventures, Times Internet, Rudy Gopalakrishnan",Seed Funding,"600,000",
75,75,21/08/2015,ePoise,Job Search Platform,Bangalore,"Orios Venture Partners, Amit Ranjan & others",Seed Funding,"500,000",
76,76,24/08/2015,Jolly Food Fellow,Food Customer analytics platform,Ahmedabad,The 1947,Seed Funding,"300,000",
77,77,24/08/2015,BookMeIn,Professional Service Appointment booking service,Mumbai,Ajmera Group of Companies,Seed Funding,"400,000",
78,78,24/08/2015,iZofy,Scientific Horoscope Online Assistance platform,Kolkata,Prime Capital Markets Ltd,Seed Funding,N/A,
79,79,24/08/2015,rBus,Tech enabled AC bus service,Mumbai,"India Quotient, Anupam Mittal & others",Seed Funding,N/A,
80,80,25/08/2015,Qyk App,On-Demand App based Professional service provider,Bangalore,"GrowX ventures, Tracxn Labs, Powai Lake Ventures, and Sahil Barua",Private Equity,"1,000,000",pre-series A
81,81,25/08/2015,EazyDiner,Restaurant Reservation Platform,Gurgaon,"DSG Consumer Partners, Saama Capital",Private Equity,"3,000,000",Series A
82,82,25/08/2015,RevX,Cross-channel CRM platform,Mumbai,"Norwest Venture Partners, Nexus Venture Partners, Helion Venture Partners, Draper Fisher Jurvetson, Peepul Capital",Private Equity,"4,000,000",Series A
83,83,25/08/2015,ICustomMadeIt,Professional Custom creators Marketplace,Pune,Group of Angel Investors,Seed Funding,"250,000",
84,84,26/08/2015,PickMyLaundry,on-Demand Washing & Dry-Cleaning,New Delhi,GHV Accelerator,Seed Funding,"100,000",
85,85,26/08/2015,Belita,On-Demand Beauty Service,Mumbai,"India Quotient, LetsVenture investors, Lead Angels",Seed Funding,"400,000",
86,86,26/08/2015,EzySolare,solar products and services marketplace,Ahmedabad,Infuse Ventures,Seed Funding,N/A,
87,87,26/08/2015,FoodTalkIndia,Online Food Community Platform,Gurgaon,Undisclosed Investor,Seed Funding,"500,000",
88,88,27/08/2015,InstaSafe,Private Cloud Networks SAAS platform,Bangalore,Group of Investors,Seed Funding,N/A,
89,89,27/08/2015,Eazy Coach,Education Marketplace,Kolkata,Ravi Agarwal,Seed Funding,N/A,
90,90,27/08/2015,Djubo.com,Cloud Based Hotel Sales Platform,New Delhi,Ibibo Group,Private Equity,N/A,Strategic Investment
91,91,28/08/2015,BetterButter.in,online recipe sharing platform,New Delhi,"Growx Ventures, Manish Singhal",Seed Funding,N/A,
92,92,28/08/2015,Vyomo,Beauty & Lifestyle Mobile Marketplace,Bangalore,Rocket Internet,Private Equity,"2,000,000",Pre-Series A
93,93,28/08/2015,RollMafia,QSR Restaurant Chain,Pune,Equentia Natural Resources,Seed Funding,"160,000",
94,94,29/08/2015,iamwire,Digital Media publishing platform,Gurgaon,"Li Tao, Li Jian, Draphant Consultants, Nitin Garg, Saurabh Jain, Mohit Agarwal",Seed Funding,N/A,
95,95,31/08/2015,DropKaffe,Online Coffee Delivery platform,Bangalore,"Manish Singhal, P39 Capital & Others",Seed Funding,"300,000",
96,96,31/08/2015,Reverie,Language Localization Cloud platform,Bangalore,"Aspada Investment Advisors, Qualcomm Ventures",Private Equity,"4,000,000",Series A
97,97,31/08/2015,Infinite Analytics,Big Data & predictive Analysis Platform,Mumbai,"Ratan Tata, Nikhil Vora & others",Private Equity,N/A,Bridge Round
98,98,31/08/2015,,,,,,,
99,99,31/08/2015,,,,,,,
100,1,02/11/2017,Prest Loans,Finance,Business & SME Loans provider,New Delhi,"Manish Poddar, Arun Garg, Parmeshwar Sharma",Seed Funding,"570,000"
101,2,02/11/2017,AadharAPI.com,Technology,Aadhaar-based API provider,Pune,CIO Angel Network,Seed Funding,N/A
102,3,02/11/2017,FreshBoxx,ECommerce,Online Grocery Store,Bangalore,Jayant Humbarwadi,Seed Funding,N/A
103,4,03/11/2017,Vagupu,Technology,Online Tutorial Marketplace,Bangalore,Undisclosed Investors,Seed Funding,"1,000,000"
104,5,03/11/2017,HalaPlay,Consumer Internet,Online Fantasy Games,Mumbai,"Kae Capital Management, Nazara Technologies",Seed Funding,N/A
105,6,03/11/2017,Kalpnik Technologies,Technology,VR based Spiritual platform,Bangalore,Venture Catalysts,Seed Funding,"500,000"
106,7,04/11/2017,Hevo Data,Technology,Real time data analytics & reporting,Bangalore,IDG Ventures India,Private Equity,"1,000,000"
107,8,06/11/2017,Smart Karma,Technology,Financial Technology Research Platform,Bangalore,IDG Ventures India,Private Equity,N/A
108,9,06/11/2017,Leverage Edu,ECommerce,Online platform for Higher Education Services,New Delhi,"Alok Mittal, Deepak Jain, Ritesh Malik, Jim Schimdktke",Seed Funding,N/A
109,10,07/11/2017,Crayon Data,Technology,Customer Engagement Platform,New Delhi,Infosys co-founder Kris Gopalakrishnan,Seed Funding,N/A
110,11,07/11/2017,DocTalk,Technology,Doctor Patient Communication platform,Mumbai,"Matrix Partners India, Khosla Ventures",Private Equity,"5,000,000"
111,12,07/11/2017,CoveIoT,Technology,Wearable tech and Internet of Things platform,Bangalore,"Titan Co Ltd, Tata Group’s watch and jewellery retailing firm",Private Equity,"5,000,000"
112,13,08/11/2017,TalentEdge,Technology,Distance Education Learning Platform,Bangalore,Lumis Partners,Private Equity,"7,600,000"
113,14,08/11/2017,Fisdom,Finance,Mutual Fund Investment App,Bangalore,Quona Capital Management,Private Equity,"3,000,000"
114,15,08/11/2017,FarmLink,eCommerce,Online platform for Agricultural products,Mumbai,"Pioneering Ventures, Syngenta AG",Private Equity,"3,000,000"
115,16,08/11/2017,OpenApp,Technology,IoT based Tech Startup,Bangalore,"Axilor Ventures, Kumar Vembu",Private Equity,"3,600,000"
116,17,09/11/2017,NoPaperForms,Technology,Enrolment Management Platform,Delhi,Info Edge,Seed Funding,"872,000"
117,18,09/11/2017,Tilite Technologies Pvt. Ltd,Technology,Saas based Corporate Travel Management Solution,Bangalore,Matrix Partners,Seed Funding,N/A
118,19,09/11/2017,Mobiliz AR,Technology,Augmented Reality based Tech platform,Bangalore,"IDG Ventures, IDFC-Parampara Fund",Private Equity,N/A
119,20,10/11/2017,Qubole,Technology,Big Data based analytics platform,Bangalore,"Singtel, Innov8, Harmony Partners",Private Equity,"25,000,000"
120,21,10/11/2017,Happily Unmarried,ECommerce,Online Gifting platform,Nw Delhi,Wipro Consumer Care,Private Equity,N/A
121,22,13/11/2017,Universal Sportsbiz Pvt. Ltd,ECommerce,Celebrity fashion accessories and merchandise,Mumbai,Accel Partners,PrivateEquity,"15,000,000"
122,23,14/11/2017,Hungry Foal,Ecommerce,Healthy & Nutrition based snacks online platform,Gurgaon,GAIL India Ltd,Seed Funding,N/A
123,23,14/11/2017,Active AI,Technology,AI based FinTech platform,Bangalore,Vertex Ventures,Private Equity,"825,0000"
124,24,15/11/2017,Sumeru,Technology,Banking Software License Platform,Bangalore,Undisclosed Investors,Seed Funding,"900,000"
125,25,15/11/2017,ElderAid Wellness,Health Care,Social Healthcare Enterprise,Bangalore,Rugmini Menon,Angel Funding,N/A
126,26,15/11/2017,Omnia Information,Technology,WiFi Analytics Platform,Delhi,Omidyar Network,Private Equity,"3,000,000"
127,27,15/11/2017,Josh Talks,Inspiration,Storytelling platform,Gurgaon,"Girish Mathrubootham, Apurva Chamaria, Rohit Chanana",Private Equity,N/A
128,28,15/11/2017,Reniso,Technology,End-to-End property management for landlords living away,New Delhi,"Nishit Sharma, Alok Srivastava",Seed Funding,N/A
129,29,17/11/2017,Kanhaiya,Inspiration,Storytelling platform,Hyderabad,Undisclosed Investors,Seed/Angel Funding,"200,000"
130,30,17/11/2017,Perspectico,Technology,Placement preparation and career growth training platform,Delhi,"SSCBS Innovation, Incubation Foundation (SIIF)",Seed/Angel Funding,N/A
131,31,20/11/2017,ONN Bikes,Technology,Self riding bike rental program,Mumbai,Z Nation Lab,Seed/Angel Funding,"692,000"
132,32,21/11/2017,Rapido,Technology,Bike and Taxi pooling online platform,Hyderabad,"Skycatcher Fund, Aravind Sanka",Seed/Angel Funding,"329,230"
133,33,21/11/2017,Heckyl,Technology,Big Data Analytics Platform,Mumbai,"Notion Capital, IDG Ventures",Private Equity,"2,700,000"
134,34,21/11/2017,Nuvepro,Technology,Managed Cloud Environment Solutions,Mumbai,1Crowd,Seed/Angel Funding,"400,000"
135,35,21/11/2017,RedBook,Technology,AI based pharmacy drugs insights platform,Mumbai,"Vida Ventures, Dr. Aniruddha Malpani",Seed/Angel Funding,"250,000"
136,36,21/11/2017,Portea,Healthcare,Healthcare facilities at doorstep,Bangalore,"Sabre Partners, MEMG CDC",Private Equity,"26,000,000"
137,37,21/11/2017,Credit Mate,Technology,Vehicle loan approval platform,Mumbai,Paytm,Private Equity,N/A
138,38,21/11/2017,Epiq Capital,Finance,Tech based investor firm,Mumbai,Global Institutional Investors,Private Equity,"20,000,0000"
139,39,22/11/2017,MiStay,Technology,Online Hotel Reservation Platform,Bangalore,Axilor Ventures,Seed/Angel Funding,N/A
140,40,23/11/2017,WittyFeed,Storytelling,Viral Content and storytelling platform,Indore,Sandeep Aggarwal,Seed/Angel Funding,N/A
141,41,24/11/2017,IDG Ventures,Finance,Venture Capitalist,Bangalore,Uniliver Ventures,Private Equity,"10,000,000"
142,42,24/11/2017,TempGo,Technology,IoT and SaaS based transportation platform,Goa,Javelin StartupO Victory Fund,Seed/Angel Funding,"250,000"
143,43,27/11/2017,Edelweiss,Finance,Diversified Financial,Mumbai,Undisclosed investors,Private Equity,"270,000,000"
144,44,27/11/2017,ERA,Technology,Identity management platform,Mumbai,Amit Patni,Seed/Angel Funding,"39,000"
145,44,27/11/2017,Smaaash,Technology,Virtual Reality based gaming platform,Mumbai,Sixth Sense Ventures,Private Equity,"3,800,000"
146,45,28/11/2017,Chumbak,Lifestyle,Designer-led consumer products,Bangalore,Gaja Capital,Private Equity,"13,000,000"
147,46,28/11/2017,FR8,Technology,Online Truck aggregator platform,Chennai,IFMR Capital,Debt Funding,"1,500,000"
148,47,28/11/2017,MobieFit,Healthcare,Health and fitness based mobile App,Goa,"NB Ventures, MediAssist",Seed/Angel Funding,"1,350,000"
149,48,28/11/2017,Stanza Living,Technology,Student accommodation platform,Delhi,"Matrix PArtners, Accel",Private Equity,"2,000,000"
150,1,01/04/2021,BYJU’S,Edu-tech,Online tutoring,Bengaluru,Innoven Capital,Series F,"460,000,000"
151,2,05/04/2021,Meesho,E-commerce,Online reselling platform,Bengaluru,SoftBank Vision Fund 2,Series E,"300,000,000"
152,3,14/04/2021,Swiggy,Online Food Delivery,Online Food Delivery,Bengaluru,"Amansa Holdings, Carmignac, Falcon Edge Capital, Goldman Sachs, Think Investments",Series J,"343,000,000"
153,4,07/04/2021,Groww,FinTech,Investment platform,Bengaluru,"MC Global Edtech, B Capital, Baron, others",Series D,"83,000,000"
154,5,14/04/2021,Beldara,E-commerce,Global B2B marketplace,Mumbai,Hindustan Media Ventures,Venture,"7,400,000"
155,1,04/03/2021,DealShare,E-commerce,Online shopping platform,"Jaipur, Rajasthan",Innoven Capital,Debt Financing,"250,000,000"
156,2,31/03/2021,Uniphore,Technology,Conversational Service Automation (CSA),Palo Alto,Sorenson Capital Partners,Series D,"140,000,000"
157,3,30/03/2021,Dunzo,E-commerce,Hyper-local delivery app,Bengaluru,Krishtal Advisors Pte Ltd,Series E,"8,000,000"
158,4,30/03/2021,BYJU’S,Edu-tech,Online tutoring,Bengaluru,"MC Global Edtech, B Capital, Baron, others",Series F,"460,000,000"
159,5,23/03/2021,SkilloVilla,Edu-tech,Career and job-oriented upskilling.,Bengaluru,"Titan Capital, others",Seed,"300,000,000"
160,6,25/03/2021,CityMall,E-commerce,Social ecommerce and online grocery platform,Gurgaon,Accel Partners,Series A,"11,000,000"
161,7,26/03/2021,DotPe,FinTech,Commerce and payments platform to offline enterprise businesses.,Gurgaon,PayU,Series A,"27,500,000"
162,1,11/02/2021,Doubtnut,Edu Tech,E-Learning Platform,Gurgaon,"SIG Global, Sequoia Capital, WaterBridge Ventures and ON Mauritius",Series B,"2,500,000"
163,2,22/02/2021,Zomato,Hospitality,Online Food Delivery Platform,Gurgaon,"Tiger Global, Kora",Venture,"250,000,000"
164,3,19/02/2021,Fingerlix,Hospitality,Semi-cooked food delivery app,Mumbai,"Rhodium Trust, Accel Partners and Swiggy",Series C,"2,747,045.20"
165,4,17/02/2021,Zolve,FinTech,Global Neobank Venture,Mumbai,Accel Partners and Lightspeed Venture Partners,Seed,"1,50,00,000"
166,5,15/02/2021,KreditBee,Finance,Digital lending platform,Bengaluru,Azim Premji’s PremjiInvest and South Korea’s Mirae Asset Venture,Series C,"75,000,000"
167,6,12/02/2021,Pepperfry,E-commerce,Multi-brand furniture brand,Mumbai,InnoVen Capital,Debt Financing,"4,773,958"
168,7,12/02/2021,Grofers,E-Commerce,Online supermarket,Gurgaon,SoftBank Vision Fund (SVF),Unspecified,"55,000,000"
169,8,09/02/2021,Nothing,Technology,Consumer Technology Venture,London,GV,Series A,"15,000,000"
170,9,09/02/2021,SplashLearn,EdTech,Game-based learning programme,Gurgaon,Owl Ventures,Series C,"18,000,000"
171,1,15/01/2021,Digit Insurance,Financial Services,Insurance Services,Bengaluru,"A91 Partners, Faering Capital, TVS Capital Funds",Venture,"1,80,00,000 "
172,2,28/01/2021,Bombay Shaving Company,Consumer Goods Company,"Shave care, beard care, and skincare products",New Delhi,Reckitt Benckiser,Venture,"6,172,258.50"
173,3,19/01/2021,DeHaat,AgriTech Startup,online marketplace for farm products and services,Patna,Prosus Ventures,Series C,"30,000,000"
174,4,19/01/2021,Darwinbox,SaaS,HR Tech,Mumbai,Salesforce Ventures,Seed,"15,000,000"
175,5,18/01/2021,mfine,Health Tech Startup,AI-powered telemedicine mobile app,Bengaluru,Heritas Capital Management,Venture Round,"16,000,000"
176,6,18/01/2021,Udayy,EdTech,Online learning platform for kids in class 1-5,Gurgaon,Sequoia Capital ,Seed Funding,"15,000,000"
177,7,11/01/2021,True Elements,Food Startup,Whole Food plant based Nashta,Pune,SIDBI Venture Capital,Series,"100,000,000"
178,8,13/01/2021,Saveo,B2B E-commerce,Pharmacies,Bengaluru,"Matrix Partners India, RTP Global, others",Seed,"4,000,000 "
179,1,15/12/2020,Bira 91,Food and Beverage,Craft Beer ,New Delhi,"Nishant Mittal, Pankaj Chaddah and Shikha Sunil Chandak",Funding,"1,273,634.07"
180,2,21/12/2020,Pine Labs,Financial Services,Payment Solutions Provider,Noida,Lone Pine Capital,Secondary Market,Undisclosed
181,3,15/12/2020,Zenoti,Technology Provider,Cloud-based software provider for the spa and salon industries,Washington,Advent International,Series D,"160,000,000"
182,4,22/12/2020,Tax Buddy India,FinTech,Online tax adviser ,Mumbai,Zenith Global,Seed,"1,000,000"
183,5,15/12/2020,Delhivery,Supply chain ,Transportation,Gurgaon,Steadview Capital ,Secondary Market,"25,000,000"
184,6,18/12/2020,PagarBook,SaaS,Employee management platform ,Bengaluru,Sequoia Capital ,Series A,"15,000,000"
185,1,30/11/2020,Codingal,EduTech,Online coding platform,Bengaluru,"Rebright Partners, Java Capital, and GSF Accelerator",Seed,"560,000"
186,2,30/11/2020,CRED,Financial Services,Credit Card Behavior Services,Bengaluru,DST Global,Series C,"80,000,000"
187,3,29/11/2020,Bira 91,Food and Beverage,Craft Beer ,New Delhi,"Sofina, Sequoia Capital, Sixth Sense Ventures, Neoplux",Bridge Funding,"3,000,000"
188,4,27/11/2020,Chumbak,Lifestyle,Gifting Startup,Bengaluru,Gaja Capital Fund (GCFII-A),Pre-series E,"1,001,047.92"
189,5,25/11/2020,Cityflo,Transportation,App-based bus commute startup,Mumbai,Lightbox Ventures,Series A,"7,700,000"
190,6,25/11/2020,Shipsy,SaaS,Software Automation Of Logistics,Gurgaon,"Sequoia Capital India’s Surge, Info Edge",Series A,"6,003,806"
191,7,25/11/2020,Unacademy,Edutech,Online Learning Platform,Bengaluru,"Tiger Global Management, Dragoneer Investment Group",Venture ,"75,000,000-100,000,000"
192,8,24/11/2020,Cashfree,FinTech,Payments and banking technology,Bengaluru,"Matrix Partners India, SAIF Partners, Ward Ferry Management and Bertelsmann India",Series B,"35,300,000"
193,9,30/11/2020,Credgenics,Fintech,Critical NPA reduction for Fintech lenders and banks,Gurgaon,"Venture Capital firm, Accel Partners and DMI Finance",Pre-Series A,"3,500,000"
194,10,23/11/2020,Country Delight,Dairy Tech,Milk delivery startup,Gurugram,Elevation Capital,Series C,"25,000,000"
195,1,28/10/2020,Nykaa,E-commerce,"Beauty, Fashion, Lifestyle, Wellness",Mumbai,Alia Bhatt,Personal Investment,NA
196,2,28/10/2020,Betterplace,Digital Solutions,Blue Collar Workforce Management Platform,Bangalore,Jungle Ventures,Series B,"10,000,000
"
