,Sr. No.,Date (dd/mm/yyyy),Startup Name,Industry/ Vertical,Sub-Vertical,City / Location,Investors’ Name,Investment Type,Amount (in USD)
2660,66,31/03/2017,Jhakaas,Consumer Internet,Offline Business Aggregator App,Mumbai,"Malini Patel, Stelcore Management Services, Anjani Prasad",Seed Funding,"155,000"
2661,67,31/03/2017,Oriano Solar,Technology,Turnkey Solar Solutions,Mumbai,Samridhi Fund,Private Equity,"3,000,000"
2662,68,31/03/2017,BigBasket,ECommerce,Online Grocer,Bangalore,Trifecta Capital,Private Equity,"7,000,000"
2663,69,31/03/2017,Rooter,Consumer Internet,Sports engagement platform,New Delhi,Intex Technologies,Private Equity,N/A
2664,70,31/03/2017,FalconBrick,Technology,Real-Estate Workflow mobile app,Bangalore,"Satveer Thakral, LetsVenture, Mumbai Angels",Seed Funding,N/A
2665,71,31/03/2017,Icertis,Technology,ERP solutions provider,Pune,"B Capital Group, Ignition Partners, Greycroft, e.ventures,  Eight Roads Ventures",Private Equity,"25,000,000"
2666,72,31/03/2017,,,,,,,
2667,73,31/03/2017,,,,,,,
2668,,,,,,,,,
2669,,,,,,,,,
2670,1,3/10/2017,ChqBook,Consumer Internet,Home Loans Aggregation platform,Gurgaon,"Startup Buddy, Apurva Chamaria,Sachin Arora, Bharat Gupta, Amit Manocha",Seed Funding,N/A
2671,2,3/10/2017,HomeCapital,Consumer Internet,Home Loan Down payment assistance program,Mumbai,Venture Catalysts,Seed Funding,N/A
2672,3,3/10/2017,Ola Cabs,Consumer Internet,App based cab hailing services,Bangalore,"Tencent, Softbank Group",Private Equity,"110,000,000"
2673,4,4/10/2017,Elanic,Consumer Internet,P2P platform for Fashion sales,Bangalore,Digital Garage,Seed Funding,N/A
2674,5,4/10/2017,CollPoll,Consumer Internet,Education collaboration platform,Bangalore,Sprout Angels,Seed Funding,"306,000"
2675,6,4/10/2017,PhonePe,Consumer Internet,Digital Wallet,Bangalore,Flipkart,Private Equity,"38,700,000"
2676,7,5/10/2017,Little Black Book,Consumer Internet,Local Recommendations and Discoveries Platform,New Delhi,"Blume Ventures, IDG Ventures & Indian Angel Network",Private Equity,"1,000,000"
2677,8,5/10/2017,Oorjan,Technology,rooftop solar platform,Mumbai,Globevestor,Seed Funding,"450,000"
2678,9,5/10/2017,Zefo,ECommerce,Ecommerce Portal for Used Goods,Bangalore,"Sequoia India, Helion Venture Partners, Beenext",Private Equity,"9,200,000"
2679,10,6/10/2017,Yaantra,ECommerce,Mobile repair and Refurbishment platform,New Delhi,Carpediem Capital,Private Equity,"3,100,000"
2680,11,6/10/2017,Farm Taaza,Technology,Fresh Produce SCM company,Bangalore,"Epsilon Venture Partners, Tara India Fund IV and others",Private Equity,"8,000,000"
2681,12,6/10/2017,Drivezy,Consumer Internet,Self Drive car and bike rental platform,Bangalore,"Das Capital, Axan Partners, Das Capital and IT Farm",Private Equity,"10,000,000"
2682,13,6/10/2017,Slice Pay,Consumer Internet,Student Micro-financing platform,Bangalore,"Das Capital, Simile Ventures",Private Equity,"2,000,000"
2683,14,9/10/2017,Agrowave,Technology,Agriculture Supply Chain management solutions,Gurgaon,Daffodil Software,Seed Funding,N/A
2684,15,9/10/2017,MyGubbi,eCommerce,Home Interior Designing Seller,Bangalore,"Firoze Irani, Vipul Parekh, Ananda Kallugadde, Rajesh K Murthy",Private Equity,"2,700,000"
2685,16,9/10/2017,IBSFintech,Technology,Treasury Risk Management Solution,Bangalore,Shailesh Haribhakti,Seed Funding,N/A
2686,17,9/10/2017,Letsservice,Consumer Internet,Auto Service Logistics & SAAS platform,Bangalore,Aequs Group,Private Equity,N/A
2687,18,9/10/2017,OneStepUp,Technology,Education Technology platform,New Delhi,Orient BlackSwan,Seed Funding,"336,000"
2688,19,9/10/2017,ThirdWatch,Technology,AI-powered anti-fraud solutions,Gurgaon,"Rahul Agarwalla, Keshav Sanghi, Batlivala & Karani Securities",Seed Funding,N/A
2689,20,10/10/2017,Parallel Dots,Technology,AI-powered deep learning solutions,Gurgaon,"Multipoint Capital,",Private Equity,"1,400,000"
2690,21,10/10/2017,Easy Diner,Consumer Internet,online restaurant reservation platform,Gurgaon,Saama Capital and DSG Consumer Partners,Private Equity,"4,500,000"
2691,22,11/10/2017,Meesho,ECommerce,Online Reseller Network,Bangalore,"SAIF Partners, YCombinator, Venture Highway",Private Equity,"3,100,000"
2692,23,11/10/2017,StanPlus,Logistics,Medical Transportation Services,Hyderabad,KStart Capital,Private Equity,"1,100,000"
2693,24,12/10/2017,UCLID,Technology,"Education Network for Institutions, teachers & Students",Hyderabad,Undisclosed investors,Seed Funding,"235,000"
2694,25,13/10/2017,Policy Bazaar,Consumer Internet,Online insurance policy aggregator,Gurgaon,"Wellington Management, DG Ventures India, True North",Private Equity,"77,000,000"
2695,26,13/10/2017,Gapoon,Consumer Internet,home maintenance services platform,Bangalore,"Vida Ventures, Snehal Mantri, Anshu Bahadur",Seed Funding,"250,000"
2696,27,13/10/2017,Chaayos,eCommerce,Online Chai ordering platform,Gurgaon,Tiger Global Management,Private Equity,"2,000,000"
2697,28,16/10/2017,KrazyBee,Consumer Internet,Micro-lending platform,Bangalore,"Xiaomi Technologies, Shunwei Capital",Private Equity,"8,000,000"
2698,29,16/10/2017,Renew Buy,Consumer Internet,Online Insurance Aggregator,New Delhi,Amicus Capital,Private Equity,"9,200,000"
2699,30,17/10/2017,Fingerlix,Consumer Internet,Food Ordering Portal,Bangalore,"Accel Partners, Zephyr Peacock",Private Equity,"7,000,000"
2700,31,18/10/2017,Bank Bazaar,Consumer Internet,Online Financial Marketplace,Chennai,Experian,Private Equity,"7,000,000"
2701,32,18/10/2017,Hasura,Technology,App building platform,Chennai,"Nexus, GREE Ventures",Private Equity,N/A
2702,33,18/10/2017,BlackBuck,Logistics,B2B Logistics provider,Bangalore,Innoven Capital,Private Equity,"7,700,000"
2703,34,18/10/2017,LenDen Club,Consumer Internet,Online peer-to-peer lending platform,Mumbai,Undisclosed Investor,Seed Funding,"500,000"
2704,35,23/10/2017,Toppr,Consumer Internet,Mobile based learning app,Mumbai,"SAIF Partners, Helion Ventures, FIL Capital Management",Private Equity,"7,000,000"
2705,36,23/10/2017,RAW Pressery,Food & Beverage,Cold pressed Juice maker,Mumbai,"DSG Consumer Partners, Sequoia Capital, Saama Capital",Private Equity,"6,000,000"
2706,37,23/10/2017,Cashe,Consumer Internet,app-only lending platform,Mumbai,IFMR Capital,Debt Funding,"3,100,000"
2707,38,23/10/2017,Park Easy,Consumer Internet,Machine learning based parking discovery,Kolkata,Rockstart Accelerator,Seed Funding,"118,000"
2708,39,24/10/2017,TagBox,Technology,Cold Chain monitoring solution,Bangalore,"Indian Angel network, IAN Fund",Seed Funding,N/A
2709,40,24/10/2017,FYRE,Food & Beverage,Herbal energy shot maker,Mumbai,Venture Catalysts,Seed Funding,"500,000"
2710,41,24/10/2017,ZipLoan,Consumer Internet,SME lending platform,New Delhi,"Matrix Partners India, WaterBridge Ventures, Whiteboard Capital, Sarbvir Singh",Private Equity,"3,000,000"
2711,42,24/10/2017,Skillenza,Consumer Internet,Online Learning Platform,Bangalore,"Blume Ventures, Indian Angel Network",Seed Funding,"722,000"
2712,43,24/10/2017,Chevon,Food & Beverage,Frozen Meat provider,Mumbai,Greenfield Advisory,Private Equity,N/A
2713,44,25/10/2017,PropStory,Consumer Internet,Real Estate content portal,Gurgaon,"Abhishek Bhatewara, Vivek Shah, Haitong Securities, Suraj Saharan, Paras Arora",Seed Funding,N/A
2714,45,25/10/2017,SpotDraft,Consumer Internet,Contract Automation,Gurgaon,"Hunch Ventures, Spiral Ventures, 500 Startups, Singapore Angel Network, Citrus Payments",Seed Funding,"550,000"
2715,46,26/10/2017,Big Basket,eCommerce,Online Grocery portal,Bangalore,Helion Ventures Partners,Private Equity,"5,000,000"
2716,47,27/10/2017,OfBusiness,Technology,B2B Finance & Fulfilment Network,Gurgaon,Kotak Mahindra Bank,Debt Funding,"3,800,000"
2717,48,27/10/2017,Olly Credit,Technology,Credit + payment mobile app,New Delhi,"Incubate Fund, Sandesh Kirkire, Anand Kumar, Yogesh Chaudhary",Seed Funding,N/A
2718,49,28/10/2017,CashFree,Technology,Payments Platform for Marketplaces and Fintechs,New Delhi,Y Combinator,Seed Funding,"120,000"
2719,50,28/10/2017,Ola Cabs,Consumer Internet,App based cab hailing services,Bangalore,ANI Technologies Pvt. Ltd,Private Equity,"7,700,000"
2720,51,30/10/2017,GoldFarm,Food & Beverage,Agriculture Technology,Coimbatore,Mahindra & Mahindra and Infuse Ventures,Private Equity,"2,000,000"
2721,52,31/10/2017,NetMeds,ECommerce,Online Pharmacy,Chennai,TannCam Investment & Sistema Asia Fund,Private Equity,"14,000,000"
2722,53,31/10/2017,MSE,Finance,Equity Stock Exchange,Mumbai,"IL&FS, Trust Capital, Rosy Blue Securities, Radhakrishan Damani and Rakesh Jhunjhunwala",Private Equity,"32,000,000"
2723,1,01/06/2018,CoinTribe,Finance,Credit-Based Lending Marketplace For Small And Medium Enterprises,Gurugram,"Sabre Partners, Puneet Dalmia & Others",Private Equity,"10,000,000"
2724,2,04/06/2018,Digiconectt,Technology,Sales Analytics and Enablement Platform,Bengaluru,Aspire Logistics LLC,Seed/ Angel Funding,"125,000"
2725,3,04/06/2018,Kashmir Box,E-Commerce,"Online Marketplace For Handicrafts, Handlooms And Local Produce",Srinagar,"Bhairavi Jani, Alok Divatia, Namrata Kaul, Sohail Hashemi, Aijaz Saleem",Seed/ Angel Funding,N/A
2726,4,05/06/2018,Crowdera,Finance,Online Crowdfunding Platform,Nagpur,"Anil Advani, Pramod Jain, Amrendra Reddy and Manish Satnaliwala. ",Seed/ Angel Funding,N/A
2727,5,05/06/2018,Zoctr,Healthcare,Online Healthcare Aggregator,Mumbai,NB Ventures and Others,Seed/ Angel Funding,N/A
2728,6,07/06/2018,Annapurna Finance,Finance,Non-Banking Financial Company,Bhubneswar,Oman India Joint Investment Fund (OIJIF),Private Equity,"23,000,000"
2729,7,07/06/2018,Meesho,Consumer Internet,Online Marketplace For Resellers,Bengaluru,"Sequoia Capital India, SAIF Partners, Y Combinator and Venture Highway",Private Equity,"11,500,000"
2730,8,10/06/2018,AyeFinance,Finance,Online Lending Platform,Gurugram,"CapitalG, SAIF Partners and LGT Impact Ventures",Private Equity,"2,15,00,000"
2731,9,11/06/2018,Theranosis,Healthcare,Specialised diagnostics Platform,Hyderabad,Mumbai Angels Network,Seed/ Angel Funding,N/A
2732,10,12/06/2018,Alpha Capital,Finance,Supplychain Finance,Mumbai,Alpha Capital,Private Equity,"1,480,0000"
2733,11,12/06/2018,eshakti,E-Commerce,Fashion e-tailer,Chennai,Paragon Partners,Private Equity,"1,01,00,000"
2734,12,12/06/2018,Daily Ninja,Consumer Internet,Hyperlocal Delivery Platform,Bengaluru,Saama Capital and Sequoia Capital ,Seed/ Angel Funding,"3,000,000"
2735,13,13/06/2018,NirogStreet,Healthcare ,An Online Platform That Connects Ayurveda Doctors With Patients,Gurugram,"Spiral Ventures, Subho Ray and Samir Kumar",Seed/ Angel Funding,"3,000,00"
2736,14,13/06/2018,Nivesh,Finance,Mass Market Mutual Fund Investment Platform,Noida,"LetsVenture, Rajan Anandan, Basab Pradhan, Vivek Khare and Bijoy George",Seed/ Angel Funding,"4,50,000"
2737,15,13/06/2018,What’s Up Life,Consumer Internet,"A Local Discovery App For Dining-Out, Party, Leisure and Events",Gurugram,Rannvijay Singha,Seed/ Angel Funding,N/A
2738,16,14/06/2018,HomeLane,Consumer Internet,Online Home Furnishing Solutions,Bengaluru,Brand Capital,Seed/ Angel Funding,"3,450,000"
2739,17,14/06/2018,Network Intelligence,Technology,Cybersecurity Specialist,Mumbai,Helix Investments,Private Equity,"48,00,000"
2740,18,18/06/2018,Tynor Othontics,Healthcare,Prosthetics Manufacturers,Chandigarh,Lighthouse Funds & Thuasne Participations,Private Equity,"21,000,000"
2741,19,18/06/2018,Elucidata,IT,Data Analytics (SaaS),Delhi & Cambridge,Hyperplane Venture Capital and several angel investors,Seed/ Angel Funding,"17,00,000"
2742,20,19/06/2018,Chrysalis,Ed-Tech,Education Services Provider,Pune,Menterra Venture & Artha Initiatives,Seed/ Angel Funding,N/A
2743,21,19/06/2018,RentSher,Consumer Internet,Online Rental Marketplace,Bengaluru,"Shorooq Investments, LetsVenture & Others",Seed/ Angel Funding,"11,00,000"
2744,22,20/06/2018,Drip capital,Finance,Trade Finance Firm,Mumbai,"Accel Partners, Sequoia India, Y Combinator and others.",Private Equity,"15,000,000"
2745,23,22/06/2018,WickedRide,Consumer Internet,Online Motorbike And Scooter Rental Platforms,Bengaluru,"Sequoia Capital, Accel Partners & Raghunandan Gangappa",Private Equity,"9,100,000"
2746,24,25/06/2018,PolicyBazaar,Consumer Internet,Online Insurance Selling Platform,Gurugram,SoftBank Vision Fund & Info Edge (India) Ltd,Private Equity,"200,000,000"
2747,25,25/06/2018,HipBar,Consumer Internet,Digital Payment Platform For Beverage Delivery,Bengaluru,Diageo India,Private Equity,"4,000,000"
2748,26,25/06/2018,Sqqrl,Finance,App-based investment platform,Gurugram,Equanimity Venture Fund,Seed/ Angel Funding,"1,000,000"
2749,27,26/06/2018,Paytm,Technology,Digital Payment Platform ,Noida,One 97 Communications,Private Equity,"89,50,000"
2750,28,26/06/2018,Sigtuple,Healthcare,Data Driven Intelligence Solutions Platform ,Bengaluru,"Accel Partners, IDG Venture, Endiya Partners, pi Ventures, VH Capital, Axilor Ventures and Binny Bansal",Private Equity,"19,000,000"
2751,29,27/06/2018,Wow Express,Technology,E-commerce Logistics Platform,Mumbai,Undisclosed Existing Investors As Well As The Tamarind Family Trust,Private Equity,"4,500,000"
2752,30,28/06/2018,Front Desk AI,Technology,An AI Platform Offering Automated Customer Service Software,Bengaluru,Speciale Invest & Others,Seed/ Angel Funding,"11,00,000"
2753,31,28/06/2018,Edureka,Ed-Tech,Online Education Platform,Bengaluru,Leo Capital,Seed/ Angel Funding,"2,000,000"
2754,32,29/06/2018,Numeroseven,Technology,An Artificial Intelligence-Based Recruitment Platform,Kolkatta,Shiva Gunapu & Others,Seed/ Angel Funding,N/A
2755,1,01/08/2017,TouchKin,Technology,Predictive Care Platform,Bangalore,Kae Capital,Private Equity,"1,300,000"
2756,2,02/08/2017,Ethinos,Technology,Digital Marketing Agency,Mumbai,Triton Investment Advisors,Private Equity,N/A
2757,3,02/08/2017,Leverage Edu,Consumer Internet,Online platform for Higher Education Services,New Delhi,"Kashyap Deorah, Anand Sankeshwar, Deepak Jain, Sadashiva NT, Arjun Mehta, Satish Kaul, Anindya Ghose",Seed Funding,N/A
2758,4,02/08/2017,Zepo,Consumer Internet,DIY Ecommerce platform,Mumbai,"Kunal Shah, LetsVenture, Anupam Mittal, Hetal Sonpal",Seed Funding,"500,000"
2759,5,02/08/2017,Click2Clinic,Consumer Internet,healthcare service aggregator,Hyderabad,"Narottam Thudi, Shireesh Palle",Seed Funding,"850,000"
2760,6,03/08/2017,SpeedBox,Logistics,On-Demand Logistics Service provider,Mumbai,Cismat Cargo Services Pvt. Ltd.,Seed Funding,"300,000"
2761,7,03/08/2017,Skill Connect,Consumer Internet,Recruitment Portal,Jaipur,Rajasthan Angel Investor Network,Seed Funding,N/A
2762,8,03/08/2017,Chai Point,Consumer Internet,Tea Delivery Portal & offline stores,Bangalore,"DSG Consumer Partners, Eight Roads Ventures India",Private Equity,N/A
2763,9,03/08/2017,Zoctr,Consumer Internet,Health Products & Services Aggregator,Mumbai,SIDBI,Private Equity,N/A
2764,10,04/08/2017,Lime Tray,Technology,Restaurant Management Solutions,New Delhi,JSW Ventures,Private Equity,N/A
2765,11,04/08/2017,CoutLoot,eCommerce,Fashion Resale Marketplace,Mumbai,"Anuj Puri, Redcliffe Capital, Artha India Ventures, Siddharth Kothari, Apoorv Ranjan Sharma,",Seed Funding,N/A
2766,12,04/08/2017,Box My Space,Logistics,Warehouse Aggregator,Mumbai,"R. Jayakumar, Vaibhav Vohra, Aditya Vazirani, Rhea Vazirani, AVN Business Solutions, Dreamweaver Investments",Seed Funding,N/A
2767,13,05/08/2017,Curatio,Healthcare,Skincare Speciality services,Chennai,Anicut Capital,Private Equity,N/A
2768,14,08/08/2017,New Castle Technologies,Technology,Hospital Management Software,Chennai,Undisclosed investors,Seed Funding,"243,000"
2769,15,08/08/2017,My Forex Eye,Consumer Internet,foreign exchange services,New Delhi,"Rahul Dev Kumar, Rajesh Mahajan, Ankit Sharma and others",Seed Funding,"220,000"
2770,16,09/08/2017,TruxApp,Logistics,Mobile based Logistics Service,New Delhi,"Venugopal Dhoot, Ajay Bhatia, Tarun Khandelwal, Ganpat Singhvi, Mandhian family & Others",Seed Funding,"3,100,000"
2771,17,09/08/2017,CroFarm,Technology,Agriculture Supply Chain solutions,Gurgaon,Factor[e] Ventures,Seed Funding,"783,000"
2772,18,09/08/2017,DoodhWala,Consumer Internet,Online milk delivery,Bangalore,Tom Varkey,Seed Funding,N/A
2773,19,10/08/2017,Stayabode,Consumer Internet,Co-Living space aggregator,Bangalore,"Incubate Fund, Sanjay Shenoy, Mridul Upreti,",Private Equity,N/A
2774,20,11/08/2017,Flipkart,eCommerce,Online Marketplace,Bangalore,Softbank,Private Equity,"2,500,000,000"
2775,21,11/08/2017,Moong Labs,Technology,Mobile games developer,New Delhi,Nazara Games,Private Equity,N/A
2776,22,11/08/2017,Ola Cabs,Consumer Internet,App based cab aggregation Service,Gurgaon,Tekne Capital Management,Private Equity,"36,000,000"
2777,23,14/08/2017,Sports Flashes,Consumer Internet,Sports Content Mobile App,New Delhi,"Bennett, Coleman and Company Ltd (BCCL),",Private Equity,N/A
2778,24,14/08/2017,Digilend,Technology,Personal Loans & EMI solutions platform,Mumbai,"InCred Finance, Fullerton India Credit Company Ltd",Seed Funding,"312,000"
2779,25,15/08/2017,KNAB Finance,Consumer Internet,Unsecured Small Business Loans,Bangalore,"InCred, Krishnakumar Natarajan, Ravi Bhardwaj",Seed Funding,"385,000"
2780,26,17/08/2017,Get Simpl,Consumer Internet,Payment Solution Mobile app,Mumbai,"Green Visor Capital LP II, IA Venture Strategies Fund II LP, Boillot Family Trust, Russell M Byrne, The Oliver R. Grace, Jr. Millennium Trust, SF Capital Investments LP",Seed Funding,N/A
2781,27,20/08/2017,Rootefy,eCommerce,Building material online store,New Delhi,"Abhinav Gupta,",Seed Funding,"187,000"
2782,28,21/08/2017,Uniphore,Technology,speech recognition startup,Chennai,IDG Ventures,Private Equity,"6,800,000"
2783,29,21/08/2017,Cerebroz,Consumer Internet,E-Tech platform,Vadodara,Undisclosed HNI’s,Seed Funding,"734,000"
2784,30,22/08/2017,Flochat,Consumer Internet,instant messaging platform,Mumbai,"iSquare Global,",Seed Funding,N/A
2785,31,22/08/2017,EasyGov,Consumer Internet,Govt service application portal,Noida,"Social Alpha, Rajan Anandan, Rajeev Ahuja, Kshitij Arora",Seed Funding,N/A
2786,32,23/08/2017,Milk Basket,Consumer Internet,Online Grocery platform,Gurgaon,Blume Ventures. Lenovo Capital and Incubator Group (LCIG),Seed Funding,N/A
2787,33,23/08/2017,Dhruva,Technology,Cloud data protection and management solutions,Pune,"Riverwood Capital, Sequoia Capital India, Nexus Venture Partners, Tenaya Capital",Private Equity,"80,000,000"
2788,34,23/08/2017,Bombay Shaving Company,eCommerce,Men Grooming product etailer,New Delhi,Fireside Ventures,Private Equity,"2,300,000"
2789,35,23/08/2017,Awign,Technology,Operations and manpower outsourcing,Bangalore,"IIT Ropar, Imanpreet Singh Arora, Sidharth Rozario, Saurabh Abichandani, Shikhar Gupta,",Seed Funding,N/A
2790,36,23/08/2017,Indiez,Technology,Software & Mobile app development platform,Bangalore,Haresh Chawla,Seed Funding,"500,000"
2791,37,24/08/2017,Ezetap,Technology,mPOS solutions provider,Bangalore,"JS Capital Management, Social Capital, Horizons Ventures,",Private Equity,"16,000,000"
2792,38,25/08/2017,Ink Monk,Consumer Internet,Online printing marketplace,Chennai,"VAMM Ventures, Raksul, Dena",Seed Funding,"750,000"
2793,39,25/08/2017,Medinfi,Consumer Internet,Online Doctor Discovery Platform,Bangalore,"PBS Srinivas, Vinod Martin,",Seed Funding,"125,000"
2794,40,28/08/2017,Mobikon,Technology,Restaurant & Hotel CRM platform,Pune,"Sistema Asia Fund, C31 Ventures, Qualgro.",Private Equity,"7,000,000"
2795,41,29/08/2017,CureFit,Consumer Internet,End to End health and wellness platform.,Bangalore,"Accel Partners, IDG Ventures, Kalaari Capital,  UC-RNT fund",Private Equity,"25,000,000"
2796,42,29/08/2017,Doxper,Technology,Healthtech IoT platform,Mumbai,"idal Health, growx ventures, Capier Investments, Globevestor & others",Seed Funding,"750,000"
2797,43,29/08/2017,Fieldassist,Technology,SAAS based sales force automation services,Gurgaon,Small Industries Development Bank of India (SIDBI),Debt Funding,N/A
2798,44,30/08/2017,Treebo,Consumer Internet,Budget Hotel Aggregator platform,Bangalore,"Ward Ferry Management and Karst Peak Capital,",Private Equity,"34,000,000"
2799,45,30/08/2017,MedGenome,Technology,Genomics Research and Diagnostics Solutions,Bangalore,"Sequoia India, Sofina s.a., Zodius Capital, Kris Gopalakrishnan, Lakshmi Narayanan,",Private Equity,"30,000,000"
2800,1,01/4/2016,Dil Mil,Consumer Internet,Matchmaking Mobile App,SFO / Bangalore,"Nelstone Ventures, Transmedia Capital, Maiden Lane Ventures, CSC Upshot & Angel investors",Private Equity,"2,700,000"
2801,2,01/4/2016,PicsDream,Consumer Internet,Online Marketplace for Photographers,Delhi,Raman Roy,Seed Funding,N/A
2802,3,01/4/2016,Process 9,Consumer Internet,online translation and transliteration,Gurgaon,"Indian Angel Network, Alok Sharma, Kris Gopalakrishnan, Saurabh Srivastava, and Ajai Chowdhry",Seed Funding,N/A
2803,4,04/4/2016,Housing,Consumer Internet,Real Estate Portal,Mumbai,Vineet Singh,Private Equity,N/A
2804,5,04/4/2016,Roll Mafia,Food & Beverage,Rolls & Biryanis QSR chain,Pune,Equentia Natural Resource & Other undisclosed investors,Seed Funding,N/A
2805,6,04/4/2016,Hungama,Consumer Internet,Digital Media Entertainment Portal,Mumbai,Xiaomi Inc,Private Equity,"25,000,000"
2806,7,04/4/2016,Highway Delite,Consumer Internet,Various Highway Help Services,Bangalore,N.S. Raghavan Centre for Entrepreneurial Learning,Seed Funding,N/A
2807,8,05/4/2016,Cult Fitness,Healthcare,Healthcare training programs,Bangalore,Mukesh Bansal,Seed Funding,N/A
2808,9,05/4/2016,Haptik,Technology,Personal Assistant App,Mumbai,Times Internet Ltd,Private Equity,N/A
2809,10,05/4/2016,Servify,Consumer Internet,Gadget & Appliances Service App,Mumbai,"Blume Ventures, Barkawi Holdings GmbH, TM Service Technology Holdings GmbH",Private Equity,N/A
2810,11,06/4/2016,Shipsy,Logistics,Logistics Solutions,Gurgaon,DTDC Express Ltd,Private Equity,"1,000,000"
2811,12,06/4/2016,gear6,Consumer Internet,Online bike service and repairs platform,Bangalore,Ninestarter,Seed Funding,"500,000"
2812,13,06/4/2016,MyGlamm,Consumer Internet,Mobile based on-demand Beauty Services platform,Mumbai,L’Occitane,Private Equity,"6,000,000"
2813,14,06/4/2016,Petoo,Consumer Internet,Online Food Delivery Platform,Bangalore,Axilor Ventures,Private Equity,"1,000,000"
2814,15,07/4/2016,Truly Social,Consumer Internet,Mobile Gaming Studio,London,Nazara Technologies Pvt Ltd,Private Equity,N/A
2815,16,08/04/2016,Little Black Book,Consumer Internet,"Curated Food, event & Lifestyle guide",New Delhi,"IDG, Indian Angel Network",Seed Funding,N/A
2816,17,08/04/2016,Vahan,Education,Mobile Education Platform,Chennai,Villgro,Seed Funding,N/A
2817,18,08/04/2016,imedilane,Consumer Internet,Online Health Diagnosis platform,New Delhi,"Mahendra Patel, Nilender Chauhan",Seed Funding,"40,000"
2818,19,11/04/2016,Living Local,Consumer Internet,Social discovery platform,Mumbai,Rattan Chadha,Seed Funding,"200,000"
2819,20,11/04/2016,Vegfru,eCommerce,Online Fruit & Vegetable Marketplace,New Delhi,Wingify,Seed Funding,N/A
2820,21,11/04/2016,Oyo,Consumer Internet,Online Branded Budget Room Booking Service,New Delhi,"Softbank, Sequoia Capital, Lightspeed Venture Partners, Greenoaks Capital, DSG Consumer Partners and Venture Nursery",Private Equity,"100,000,000"
2821,22,11/04/2016,PriceRaja,Consumer Internet,Price Comparison Portal,Gurgaon,Prashant Puri,Seed Funding,"300,000"
2822,23,12/04/2016,MagicX,Consumer Internet,On-Demand Task Management App,Bangalore,"Kris Gopalakrishnan, Dr. Ranjan Pai",Seed Funding,"1,000,000"
2823,24,12/04/2016,Happydemic,Consumer Internet,Artist Discovery & Booking platform,Mumbai,Shaan,Seed Funding,N/A
2824,25,12/04/2016,LenDenClub,Finance,Peer-to-Peer Lending Platform,Mumbai,"Anirudh Damani, Daud Ali, Narendra Karnavat, Vikas Kapoor, Vikram Lakhotia, Krishna Jhunjhunwaala, Jayesh Shah",Seed Funding,N/A
2825,26,12/04/2016,Indi.com,Consumer Internet,Video Social Network,N/A,Anil Kapoor,Seed Funding,N/A
2826,27,13/04/2016,Legalraasta,Consumer Internet,Online legal Services for Startups,New Delhi,"Pravin Khandelwal, Yatin Kumar Jain",Seed Funding,"1,000,000"
2827,28,13/04/2016,RainCan,Consumer Internet,Subscription-based grocery delivery Mobile App,Pune,Dr. Aniruddha Malpani,Seed Funding,"150,000"
2828,29,13/04/2016,Hippily,eCommerce,Fashion ECommerce App,Mumbai,"Dr. Sridhar Ramaswamy, Rakesh Mathur",Seed Funding,"250,000"
2829,30,13/04/2016,kredX,eCommerce,Invoice discounting  Marketplace,Bangalore,"Prime Venture Partners,",Seed Funding,"750,000"
2830,31,14/04/2016,Wedwise,Consumer Internet,Wedding related services community,New Delhi,StartUp Equity Partners,Seed Funding,N/A
2831,32,14/04/2016,BeaconsTalk,Technology,contextual mobile advertising,Mumbai,"Rajeev Agrawal, Prashant Gooty",Seed Funding,"100,000"
2832,33,15/04/2016,Deal 4Loans,Consumer Internet,Loan Comparison Portal,Noida,"Ram Shriram, Neeraj Arora, Puru Vashishtha",Seed Funding,N/A
2833,34,15/04/2016,RenewBuy,Consumer Internet,Online Car & Bike Insurance Comparison portal,New Delhi,Mount Nathan Advisors,Seed Funding,"1,000,000"
2834,35,15/04/2016,Blue Box Media,Consumer Internet,Online Tech Portals,Jaipur,"Mahavir Pratap Sharma, Ajay Data, Yogesh Chaudhary, Sanjay Phophaliya, Siddharth Agarwal, Kamal Kothari",Seed Funding,N/A
2835,36,15/04/2016,Vyomo,Consumer Internet,On-Demand Beauty Service provider,New Delhi,Naturals Salon Chain,Private Equity,"15,000,000"
2836,37,15/04/2016,Organicshop,eCommerce,Marketplace for organic products,Jaipur,"Vivek Nathani, Yogesh Chaudhary, Mahavir Pratap Sharma, Kamal Kothari, H C Jain",Seed Funding,N/A
2837,38,15/04/2016,MInd Your Fleet,Consumer Internet,Car Rental Software,Noida,Undisclosed Investors,Seed Funding,N/A
2838,39,15/04/2016,NestAway,Consumer Internet,Furnished Home Rental Platform,Bangalore,Tiger Global,Private Equity,"30,000,000"
2839,40,15/04/2016,Tapchief,Consumer Internet,Expert Advice Platform,Bangalore,Vijay Shekhar Sharma,Seed Funding,"150,000"
