,Sr. No.,Date (dd/mm/yyyy),Startup Name,Industry/ Vertical,Sub-Vertical,City / Location,Investors’ Name,Investment Type,Amount (in USD)
739,10,10/07/2018,Kinara Capital,Finance,Lending Platform For Micro and Small Enterprises,Bengaluru,ResponsAbility,Private Equity,"5,000,000"
740,11,10/07/2018,Shop 101,Consumer Internet,Mobile Storefront And Commerce Platform For Sellers,Mumbai,"Stellaris Venture Partners, Vy Capital, Raghunandan G, and Ramakant Sharma ",Private Equity,"5,000,000"
741,12,11/07/2018,Sambandh,Consumer Internet,Online Micro Lending Platform ,Rourkela,Base of Pyramid Asia (BOPA) Pte Ltd,Private Equity,"2,500,000"
742,13,12/07/2018,19th mile,IT,Artificial intelligence-based sales acceleration software platform,Gurugram,"Rishi Vasudev, Excelsior Investments, Ritesh Vohra, Praveer Kumar, Prashant Gupta and Others",Seed/ Angel Funding,"180,000"
743,14,12/07/2018,5th Vital,Healthcare,Home diagnostics services provider,Bengaluru,Brand Capital and Others,Seed/ Angel Funding,"500,000"
744,15,13/07/2018,MEngage,Healthcare,A Doctor-Patient Engagement Platform,Jaipur,"Siddharth Agarwal, Mahavir Sharma, Amit Singal, 100 Co-founders Lab and others.",Seed/ Angel Funding,"175,000"
745,16,17/07/2018,Ofbusiness,Finance,Online Lending Platform For SME,Gurugram,"Creation Investments, Falcon Edge, Matrix Partners India and Zodius Capital ",Private Equity,"29,000,000"
746,17,17/07/2018,Cars24,Consumer Internet,Online Used Car Marketplace,Gurugram,"Kingsway FCI Fund, KCK Global & Others",Private Equity,"4,97,00,000"
747,18,18/07/2018,The Ken,Consumer Internet,Subscription-Only News Website,Bengaluru,Omidyar Network & Others,Seed/ Angel Funding,"15,00,000"
748,19,19/07/2018,Book My Show,Consumer Internet,Online Ticketing Platform,Mumbai,"TPG Growth, The Rise Fund & Others",Private Equity,"10,00,00,000"
749,20,20/07/2018,HousingMan,Consumer Internet,Property Discovery Platform,Bengaluru,N/A,Seed/ Angel Funding,"1,500,000"
750,21,21/07/2018,PaySense,Consumer Internet,Online Consumer Lending Platform,Mumbai,PayU & Others,Private Equity,"18,000,000"
751,22,23/07/2018,Yulu Bikes,Technology,Bicycle-Sharing Platform,Bengaluru,N/A,Seed/ Angel Funding,N/A
752,23,23/07/2018,VTION,Technology,Media Analytics ,Gurugram,"AngelList, Rahul Khanna, Rajeev Arora and Ram Ramsundar.",Seed/ Angel Funding,"2,80,000"
753,24,23/07/2018,Log9 Materials,Technology,Nanotechnology Company Specializing In Graphene,Bengaluru,"Metaform Ventures, Hemant Luthra, Micro venture capital firm GEMS Partners and Others",Seed/ Angel Funding,"4,36,000"
754,25,24/07/2018,kidovators,Ed-Tech,Skill Learning Platform,Bengaluru,Gray Matters,Seed/ Angel Funding,"180,000"
755,26,24/07/2018,Digit,Consumer Internet,Online Insurance Startup,Pune,Fairfax,Private Equity,"4,50,00,000"
756,27,25/07/2018,Black Soil,Finance,Non-Banking Financial Company,Mumbai,"Allcargo Logistics, Navneet Education and Mahavir Agency",Private Equity,"1,70,00,000"
757,28,25/07/2018,Trell,Consumer Internet,Mobile-First Video Blogging App,Bengaluru,"BeeNext , WEH Ventures and Sprout Ventures",Seed/ Angel Funding,"12,50,000"
758,29,25/07/2018,iqlect,Technology,Data Analytics Firm,Bengaluru,Ventureast and Exfinity,Seed/ Angel Funding,"25,00,000"
759,30,26/07/2018,Entropik,IT,Software-As-A-Service Platform,Bengaluru,"Bharat Innovation, IDFC-Parampara Capital, Arthavida Ventures, Jitendra Gupta & Others",Seed/ Angel Funding,"11,00,000"
760,31,26/07/2018,Bitla Software,Technology,Travel-Focused Tech Startup,Bengaluru,MakeMyTrip,Private Equity,N/A
761,32,26/07/2018,TheCapitalNet,Fin-Tech,Unified Global Investments Ecosystem,Hyderabad,Lindwall Family Investments LLC (LFI),Private Equity,"500,000"
762,33,30/07/2018,Shuttl,Consumer Internet,Bus Aggregation Platform,Gurugram,Amazon Alexa Fund & Dentsu Ventures,Private Equity,"1,10,00,000"
763,34,30/07/2018,Cure Fit,Consumer Internet,Health and fitness Platform,Bengaluru,"IDG Ventures, Accel Partners, Kalaari Capital and Others",Private Equity,"120,000,000"
764,35,31/07/2018,Five Star Group,Fin-Tech,Non-Bank Lending Platform For SME,Chennai,"TPG, Norwest Venture Partners, Sequoia Capital & Matrix Partners",Private Equity,"100,000,000"
765,36,31/07/2018,Healthsignz,Healthcare,Health and Well being Platform,Hyderabad,Kantilal Patel,Seed/ Angel Funding,"5,000,000"
766,1,01/7/2016,RazorPay,Consumer Internet,Online Payment Gateway,Bangalore,MasterCard,Private Equity,N/A
767,2,01/7/2016,DarwinBox,Technology,HR Software Services Startup,Hyderabad,"3one4 Capital, Tracxn Labs, Aaruha Technology Fund, Endiya Partners",Seed Funding,N/A
768,3,01/07/2016,Venture Catalysts,Consumer Internet,Seed Investment & Innovation Platform,Mumbai,Zaffiro Ventures,Seed Funding,"500,000"
769,4,01/07/2016,PressPlay TV,Consumer Internet,Video Content Discovery Platform,New Delhi,"Sequoia Capital, SD Ventures, Vistaar Investment Advisors Pvt. Ltd.",Private Equity,N/A
770,5,02/07/2016,Playment,Consumer Internet,Mobile Marketplace for Crowdsourced Work,Bangalore,SAIF Partners,Private Equity,"700,000"
771,6,04/07/2016,WealthTrust,Consumer Internet,Wealth Management App,Mumbai,India Quotient,Seed Funding,N/A
772,7,04/07/2016,Curefit,Consumer Internet,Online Preventive Healthcare Platform,Bangalore,"Accel Partners, IDG Ventures, Kalaari Capital",Private Equity,"15,000,000"
773,8,04/07/2016,StitchWood,eCommerce,Custom Furniture Online,Mumbai,Deepak Gupta,Seed Funding,"200,000"
774,9,04/07/2016,Grab.in,Logistics,hyperlocal logistics service,Mumbai,Aramex Ventures Llc,Private Equity,"2,000,000"
775,10,04/07/2016,Fulfil.IO,Consumer Internet,Cloud Based ERP Software,US,Rajan Anandan,Seed Funding,N/A
776,11,04/07/2016,NeoGrowth,Finance,SME Lending platform,Mumbai,"IIFL Wealth Management Seed Venture Fund, Omidyar Network, Khosla Impact, Aspada",Private Equity,"16,000,000"
777,12,05/07/2016,SeeDoc,Consumer Internet,Video Based Doctor Consulting platform App,Gurgaon,YourNest Angel Fund  & Others,Private Equity,"1,000,000"
778,13,05/07/2016,BookMyShow,Consumer Internet,Event & Movie Ticketing platform,Mumbai,"Stripes Group, Network 18, Accel Partners, SAIF Partners",Private Equity,"82,000,000"
779,14,05/07/2016,Flyrobe,eCommerce,Online fashion rental platform,Mumbai,"Sequoia Capital, Rohit Bansal, Kunal Bahl, Sandeep Tandon, Kunal Shah, Zishaan Hayath,  Abhishek Jain",Seed Funding,"1,700,000"
780,15,06/07/2016,HappilyUnmarried,eCommerce,Online Merchandize etailer,New Delhi,Info Edge (India) Ltd,Private Equity,"740,000"
781,16,06/07/2016,Don’t Scratch Your Head,Technology,Full Stack Offline & Online ERP Solution,Ahmedabad,"Gaurav Singhvi, Zaffiro Ventures",Seed Funding,"250,000"
782,17,06/07/2016,Wedding Wishlist,Consumer Internet,"Wedding Wishlist, Gifts & Registry Creation platform",Chennai,"Kirthiga Reddy, Renuka Ramanath,Cherry Tin",Seed Funding,"297,000"
783,18,07/07/2016,AppDaily,Technology,Mobile Security App development & Distribution,Mumbai,"Kalaari Capital, Qualcomm Ventures, ru-Net, Zodius Technology Opportunities Fund,",Private Equity,"2,000,000"
784,19,07/07/2016,Adytude,Consumer Internet,Gamified Consumer Insights Portal,New Delhi,Indian Angel Network,Private Equity,"1,000,000"
785,20,07/07/2016,Quickli,Logistics,On-Demand Delivery Startup,Gurgaon,"AVG Group, 500 Startups",Private Equity,N/A
786,21,07/07/2016,SpectraVR,Technology,Virtual Reality Content Studio,Mumbai,Rothenberg Ventures,Seed Funding,N/A
787,22,08/07/2016,Pitstop,Consumer Internet,Online Car Repair and Servicing Booking platform,Bangalore,"Alex Chua, Rahul Garg",Seed Funding,N/A
788,23,08/07/2016,HolaChef,Consumer Internet,Online Food Ordering & Delivery Platform,Mumbai,"Kalaari Capital, India Quotient",Private Equity,"1,950,000"
789,24,11/07/2016,Purplle,eCommerce,Beauty Products Marketplace,Mumbai,"JSW Ventures, Blume Ventures & IvyCap Ventures",Private Equity,"6,000,000"
790,25,11/07/2016,Trak N Tell,Technology,Car Tracking & Safety System,Gurgaon,Brian Acton,Private Equity,"3,500,000"
791,26,11/07/2016,Overcart.com,eCommerce,Unboxed & refurbished electronic products marketplace,Gurgaon,"JSW Ventures, Omidyar Network, Sattva Capital, Venture Works",Private Equity,"3,000,000"
792,27,12/07/2016,SirionLabs,Technology,SAAS based Service Agreement Management,Gurgaon,Sequoia Capital,Private Equity,"12,250,000"
793,28,12/07/2016,GyanDhan,Consumer Internet,Education Focused Financing Platform,New Delhi,"Stanford Angels & Entrepreneurs, Harvard Angels",Seed Funding,N/A
794,29,12/07/2016,MintM,Consumer Internet,Digital Marketing & AdTech Platform,Bangalore,"Mumbai Angels,  Times Internet",Private Equity,N/A
795,30,12/07/2016,HitGrit,Consumer Internet,Online Legal Consultation platform,Chandigarh,"Ashish Mahajan, Sarvesh Sharma",Seed Funding,N/A
796,31,12/07/2016,Find My Stay,Consumer Internet,Online Budget Hotel Aggregator & Booking Platform,New Delhi,"Rishi Parti, Yogesh Bansal",Seed Funding,N/A
797,32,13/07/2016,YAAP,Consumer Internet,"Online Content Discovery, Creation & Distribution Platform",New Delhi,Rainmaker Ventures,Private Equity,"5,000,000"
798,33,13/07/2016,Utoo Cabs,Consumer Internet,Cab aggregation & Rental platform,Chennai,Ajay Piramal,Seed Funding,N/A
799,34,13/07/2016,Twigly,Consumer Internet,Online Food Ordering & Delivery Startup,Gurgaon,"Tracxn Labs, Hyderabad Angels, Kunal Shah, Gaurav Bhalotia",Seed Funding,"600,000"
800,35,13/07/2016,ShareChat,Consumer Internet,Vernacular Language Content Creation & Sharing App,Bangalore,"SAIF Partners, India Quotient",Private Equity,"1,350,000"
801,36,13/07/2016,Urban Tailor,Consumer Internet,E-Tailoring service provider,Bangalore,Unitus Seed Fund,Private Equity,N/A
802,37,13/07/2016,RentMojo,Consumer Internet,Online Furniture Renting Platform,Bangalore,"Accel Partners, IDG Ventures India",Private Equity,"5,000,000"
803,38,13/07/2016,CityFurnish,Consumer Internet,Online Furniture Renting Platform,Gurgaon,Brand Capital,Seed Funding,N/A
804,39,13/07/2016,HEAL Institute,Healthcare,Sports Focused Healthcare Startup,Mumbai,"Jaspal Bindra, Parth Jindal",Seed Funding,N/A
805,40,14/07/2016,Augrav,eCommerce,Personalized precious Jewellery etailer,Coimbatore,Keiretsu Forum,Seed Funding,"450,000"
806,41,14/07/2016,ShoppinPal,Technology,M-Commerce Solutions for Retail Stores,Pune,"Plug and Play Tech Center, Steelhead Ventures & Others",Private Equity,"1,070,000"
807,42,14/07/2016,TransTutors / AskIITians,Consumer Internet,Online Education & Tutoring portals,New Delhi,500 Startups,Private Equity,N/A
808,43,15/07/2016,WorkApps,Technology,Enterprise Work Management Software,Pune,SRI Capital,Seed Funding,"1,000,000"
809,44,15/07/2016,BankerBay,Consumer Internet,Online Investment Banking platform,Bangalore,undisclosed investors,Private Equity,"2,000,000"
810,45,15/07/2016,BaggOut,eCommerce,Women’s Fashion etailer,New Delhi,"Sumit Jain, Sumit Jain, Anurag Gupta, Varun Khanna, Faraz Khan",Seed Funding,N/A
811,46,15/07/2016,TripShelf,eCommerce,Travel Package Marketplace,New Delhi,GEMS group,Seed Funding,"250,000"
812,47,15/07/2016,SatvaCart,eCommerce,Online Grocers,New Delhi,"Abhijit Avasthi, Karan Chellani, SP Vijay",Seed Funding,N/A
813,48,15/07/2016,Ridlr,Consumer Internet,Public Transport Mobile App,Mumbai,"Times Internet, Innoven Capital, Matrix Partners India, Qualcomm Ventures",Private Equity,"6,000,000"
814,49,18/07/2016,Yellowdig,Consumer Internet,Online Learning Platform,Pune,SRI Capital,Seed Funding,"650,000"
815,50,18/07/2016,Zuppler,Consumer Internet,Online Food Ordering platform,New Delhi,SRI Capital,Seed Funding,"650,000"
816,51,18/07/2016,BlueStone,eCommerce,Jewellery Etailer,Mumbai,"IIFL and Accel Partners, Kalaari Capital, IvyCap Ventures, RB Investments",Private Equity,"30,000,000"
817,52,18/07/2016,underDOGS,Technology,Game Development Startup,Mumbai,Intelli Reboot Digital Pvt. Ltd,Private Equity,N/A
818,53,18/07/2016,ImageProVision,Technology,Image Analysis Solutions,Pune,Satish Jamdar,Seed Funding,N/A
819,54,19/07/2016,Sagacito,Technology,Cloud-Based Enterprise Solutions,New Delhi,Star India Pvt. Ltd,Private Equity,"10,000,000"
820,55,19/07/2016,Deal4Loans / Wishfin,Consumer Internet,"
Loans Comparison platform



",Noida,Franklin Templeton International Services Pvt. Ltd,Private Equity,"15,000,000"
821,56,19/07/2016,NiYO Solutions,Technology,Payroll & Benefits Software solutions,Bangalore,Prime Venture Partners,Private Equity,"1,000,000"
822,57,19/07/2016,AppLop,Consumer Internet,Mobile Apps SaaS Platform,Gurgaon,Green House Ventures Accelerator,Seed Funding,"250,000"
823,58,20/07/2016,Tax2Win,Consumer Internet,Online Tax Filing Portal,Jaipur,Undisclosed Investors,Private Equity,"1,000,000"
824,59,20/07/2016,Truckola,Logistics,Tech-focused cargo transport startup,Mumbai,"Abhishek Agarwal, Krishnakumar Nataraj, Sarath Sura, Shanti Mohan, Sarthak and Nihit Agarwal, Suramya Gupta",Seed Funding,"595,000"
825,60,20/07/2016,iServe Financial,Consumer Internet,Loan Comparison & Deals platform,Pune,Nilesh Shah,Seed Funding,N/A
826,61,21/07/2016,MyTaxiIndia,Consumer Internet,Online Car rental booking platform,New Delhi,Nihon Kotsu Co,Private Equity,"1,000,000"
827,62,21/07/2016,AbeRuk,eCommerce,Online Marketplace for books,Bangalore,Swastika Company Pvt Ltd,Seed Funding,N/A
828,63,21/07/2016,Wiwigo,Consumer Internet,Inter-City Taxi Booking platform,Bangalore,Indian Angel Network,Seed Funding,"595,000"
829,64,21/07/2016,Drums Food,Food & Beverage,Yogurt and Ice Cream maker,Mumbai,"Verlinvest, DSG Consumer Partners

",Private Equity,"6,600,000"
830,65,22/07/2016,Treebo Hotels,Consumer Internet,Budget Hotel Aggregator & Booking platform,Bangalore,"Bertelsmann India Investments, SAIF Partners, Matrix Partners India. ",Private Equity,"16,700,000"
831,66,22/07/2016,Skrilo,Consumer Internet,Mobile Marketing & Rewards Platform,Gurgaon,"Anuj Srivastava, Arvind Tiku",Seed Funding,"1,500,000"
832,67,22/07/2016,UrDoorStep,Consumer Internet,On-demand Grocery delivery portal,Bangalore,CP Murali,Seed Funding,"300,000"
833,68,22/07/2016,SimplyMoveIn,eCommerce,online marketplace for curated rental properties,Bangalore,Swastika Company Ltd,Seed Funding,N/A
834,69,25/07/2016,QwikCilver,Consumer Internet,Gift Card Services Provider,Bangalore,"Sistema Asia Fund, Amazon Asia-Pacific, Accel India, Helion Venture Partners",Private Equity,"10,000,000"
835,70,25/07/2016,QDesk,Consumer Internet,Online Workspace provider,New Delhi,"Anuraag Jaipuria, Rishi Kajaria, Ruchirans Jaipuria, Dheeraj Jain, Ankush Nijhawan, Gaurav Bhatnagar, Manish Dhingra",Seed Funding,N/A
836,71,25/07/2016,10i Commerce Services,Technology,ECommerce Technology Solutions,Bangalore,Nandan Nilekani,Seed Funding,N/A
837,72,25/07/2016,Lucideus,Technology,Cyber Security Solutions,New Delhi,Sanjay Baweja,Seed Funding,N/A
838,73,26/07/2016,WakoW,Consumer Internet,Hyperlocal Interest based Mobile Social Network,New Delhi,Undisclosed Investor,Seed Funding,"141,000"
839,74,26/07/2016,Zoom Car,Consumer Internet,Self Driver Car Rentals,Bangalore,"Ford Motor Company, Sequoia Capital, Reliance Ventures",Private Equity,"25,000,000"
840,75,26/07/2016,e27,Consumer Internet,Online Tech Media Portal,Singapore,TechTemple Group,Private Equity,"2,200,000"
841,76,26/07/2016,Big Deal,Consumer Internet,Student Deals Discovery Platform,New Delhi,EVC Ventures,Seed Funding,"100,000"
842,77,27/07/2016,Square Plums,Consumer Internet,Shared Accommodation Discovery platform,Bangalore,Indian Angel Network,Seed Funding,"446,000"
843,78,27/07/2016,IStyleyou,Consumer Internet,Online Fashion Styling & Chat app,Gurgaon,Rannvijay Singh,Seed Funding,N/A
844,79,27/07/2016,Mezi,Consumer Internet,AI based personal Shopping Assistant,SFO,"Nexus Venture Partners, Saama Capital, American Express Ventures",Private Equity,"9,000,000"
845,80,27/07/2016,Byndr,Consumer Internet,Mobile learning management platform,Hyderabad,Education Design Studio,Seed Funding,"700,000"
846,81,28/07/2016,Modasta,Consumer Internet,Multi-lingual health content portal,Bangalore,Undisclosed HNIs,Seed Funding,"1,500,000"
847,82,28/07/2016,MaxWholesale,eCommerce,B2B Wholesale Marketplace,New Delhi,"Maple Capital Advisors, Abhinav Grover",Seed Funding,"150,000"
848,83,28/07/2016,Neuron,Technology,Machine Learning Platform,New Delhi,"Harvinder Singh Bhatia, TLabs Accelerator",Seed Funding,"200,000"
849,84,28/07/2016,Tiyo,Consumer Internet,Doctor Discovery & healthcare info platform,Kolkata,"Anish K, Ajith Nair",Seed Funding,"120,000"
850,85,29/07/2016,GoCoop,eCommerce,Social Marketplace for Cooperative Enterprises,Bangalore,"Kris Gopalakrishnan, Saha Fund",Private Equity,"830,000"
851,86,29/07/2016,Lemon Leaf,Technology,Fresh Fruit and Vegetable Supply Chain Tech Builder,New Delhi,"Saurabh Sahni, Tushar Gupta",Seed Funding,"133,000"
852,87,29/07/2016,Appsay,Consumer Internet,Customer Engagement Platform,Pune,"Shreyans Shah, Mayank Shah",Seed Funding,"150,000"
853,88,29/07/2016,Fella Homes,Consumer Internet,Home Rental discovery & Booking platform,Gurgaon,Undisclosed investors,Seed Funding,"2,000,000"
854,89,29/07/2016,HelloDhobi,Consumer Internet,On-Demand Laundry & Dry cleaning Services,Pune,Swastika Company Ltd,Seed Funding,N/A
855,90,,,,,,,,
856,,,,,,,,,
857,,,,,,,,,
858,1,01/07/2017,Billion Loans,Consumer Internet,Peer to Peer Lending platform,Bangalore,Reliance Corporate Advisory Services Ltd,Seed Funding,"1,000,000"
859,2,03/07/2017,Ecolibriumenergy,Technology,Energy management solutions provider,Ahmedabad,"Infuse Ventures, JLL",Private Equity,"2,600,000"
860,3,04/07/2017,Droom,eCommerce,Online marketplace for automobiles,Gurgaon,"Asset Management (Asia) Ltd, Digital Garage Inc",Private Equity,"20,000,000"
861,4,05/07/2017,Jumbotail,eCommerce,online marketplace for food and grocery,Bangalore,"Kalaari Capital, Nexus India Capital Advisors",Private Equity,"8,500,000"
862,5,05/07/2017,Moglix,eCommerce,B2B marketplace for Industrial products,Noida,"International Finance Corporation, Rocketship, Accel Partners, Jungle Ventures, Shailesh Rao, Venture Highway",Private Equity,"12,000,000"
863,6,05/07/2017,Timesaverz,Consumer Internet,Hyperlocal home services provider,Mumbai,BCCL,Private Equity,"1,000,000"
864,7,06/07/2017,Minjar,Technology,Cloud Solutions provider,Bangalore,"Blume Ventures, Contrarian Capital India Partners, Emergent Ventures India, Pallav Nadhani, Ashish Gupta, Sharad Sharma, Sirion Labs",Seed Funding,N/A
865,8,06/07/2017,MyCity4kids,Consumer Internet,parenting blog and kids’ events discovery platform,Gurgaon,N/A,Seed Funding,N/A
866,9,07/07/2017,Clip App,Consumer Internet,Digital Media Video platform,Bangalore,"India Quotient, Shunwei Capital",Seed Funding,"1,000,000"
867,10,07/07/2017,Upwardly.in,Consumer Internet,MF investment platform,Bangalore,"Sreeram Iyer, Suvo Sarkar, Anita Gupta, Likemind Ventures",Seed Funding,N/A
868,11,10/07/2017,Autorox.co,Technology,Workshop Management Software Platform,Hyderabad,Mitsui & Co.,Private Equity,"3,000,000"
869,12,11/07/2017,Fabogo,Consumer Internet,Salon & Spa Aggregation & Discovery platform,Pune,Dunamis Ventures Pte Ltd,Private Equity,"2,250,000"
870,13,11/07/2017,Flickstree,Consumer Internet,Video Content Discovery Platform,Mumbai,"Venture Catalysts, Sourav Ganguly, Ankit Aditya, Moksh Sports Ventures",Seed Funding,"464,000"
871,14,11/07/2017,Design Cafe,Consumer Internet,Online Interior Design platform,Bangalore,"Fireside Ventures, Apurva Salarpuria, Sidharth Pansari, Sprout Capital",Seed Funding,N/A
872,15,12/07/2017,Innoviti,Technology,Digital payments solutions,Bangalore,"SBI-FMO Fund, Bessemer Venture Partners, Catamaran Ventures",Private Equity,"18,500,000"
873,16,12/07/2017,VDeliver,Logistics,Door Step Delivery platform,Hyderabad,"Corvus Ventures, MAPE Advisory Group",Private Equity,N/A
874,17,12/07/2017,Bottr.me,Technology,Chatbot creation tool,Bangalore,"500 Startups, Purvi Capital, Rajan Anandan, Abhishek Gupta",Seed Funding,N/A
875,18,12/07/2017,Arcatron,Technology,Next Gen Mobility device manufacturer,Pune,Indian Angel Network,Seed Funding,N/A
876,19,14/07/2017,QwikSpec,Technology,Construction site operations and analytics platform,Bangalore,"Brigade Innovations LLP, TV Mohandas Pai, Suhail Rahman, Bobby Reddy, M George Oommen",Seed Funding,"540,000"
877,20,14/07/2017,Chumbak,eCommerce,Designer consumer products Marketplace,Bangalore,Blacksoil Capital Pvt. Ltd,Private Equity,"1,700,000"
878,21,17/07/2017,Increff,Technology,Sales Solutions for Fashion Brands,Bangalore,"Sequoia Capital, Grey Orange, Rajesh Ramaiah, Anshuman Das, Rishi Das",Seed Funding,"2,000,000"
879,22,17/07/2017,Vayana,Technology,Enterprise Banking Solutions,Pune,"IDG Ventures India Advisors, Jungle Ventures",Private Equity,"4,000,000"
880,23,18/07/2017,MObiquest,Technology,Mobile Services & Solutions,Noida,One97 Communication Ltd,Private Equity,N/A
881,24,18/07/2017,Ambee,Consumer Internet,Ambulance Aggregation Services,Hyderabad,"Uber Technologies Inc, Amaya Capital LLP",Seed Funding,N/A
882,25,18/07/2017,Ideal Insurance,Consumer Internet,Online Insurance platform,Kolkata,Xelpmoc,Seed Funding,N/A
883,26,18/07/2017,Hypernova Interactive,Technology,Mobile games creator,Bangalore,Kae Capital,Seed Funding,N/A
884,27,19/07/2017,Rentomojo,Consumer Internet,Consumer Leasing Platform,Bangalore,"ain Capital Ventures, Renaud Laplanche",Private Equity,"10,000,000"
885,28,19/07/2017,AirCTO,Consumer Internet,AI powered recruitment platform,Bangalore,Francesco Cara,Seed Funding,N/A
886,29,19/07/2017,Playablo,Technology,Gamified Learning App,Bangalore,ABI-Showatech (India) Ltd,Seed Funding,"600,000"
887,30,20/07/2017,Trupay,Technology,Online payments platform,Gurgaon,"Kae Capital, M&S Partners,",Seed Funding,"700,000"
888,31,21/07/2017,Brick2Wall,eCommerce,Online Marketplace for Construction Material,Gurgaon,"Subramani Somasundaram, Sundeep Sahni, Mayank Mittal & Others",Seed Funding,"200,000"
889,32,21/07/2017,FableStreet,eCommerce,Women Work wear etailer,New Delhi,"Harmeet Bajaj, Pameela P, Fusiontech Ventures & Others",Seed Funding,N/A
890,33,21/07/2017,Monsoon Fintech,Technology,Machine Learning Access platform,New Delhi,"Sunil Kalra, Aditya Singh, Rishi Srivastava, Rajan Anandan",Seed Funding,N/A
891,34,21/07/2017,MonkeyBox,Consumer Internet,Healthy Food Delivery Platform,Bangalore,"Blume Ventures, NB Ventures, Nspira",Seed Funding,N/A
892,35,25/07/2017,Noticeboard,Consumer Internet,Mobile-first Enterprise communication platform,Bangalore,"Stellaris Venture Partners,",Private Equity,"1,200,000"
893,36,25/07/2017,Byju’s,Consumer Internet,Mobile Learning App,Bangalore,Tencent Holdings,Private Equity,"35,000,000"
894,37,26/07/2017,Creator’s Gurukul,Others,Co-Working Space Provider,New Delhi,Yuvraj Singh,Seed Funding,N/A
895,38,26/07/2017,Fab Hotels,Consumer Internet,Budget hotels brand & Aggregator Platform,New Delhi,Goldman Sachs,Private Equity,"25,000,000"
896,39,26/07/2017,ThinkerBell,Consumer Internet,Assisted Learning Startup,Bangalore,"Indian Angel Network, Anand Mahindra",Seed Funding,"200,000"
897,40,27/07/2017,1mg,eCommerce,Online Pharmacy,Gurgaon,"HBM Healthcare Investments, Maverick Capital Ventures, Sequoia India, Omidyar Network and Kae Capital",Private Equity,"15,000,000"
898,41,28/07/2017,Jhakaas,Consumer Internet,App-based Aggregator of Offline Businesses,Mumbai,Amen Dhyllon,Seed Funding,N/A
899,42,28/07/2017,BigStylist,Consumer Internet,Beauty Services Marketplace,Mumbai,Info Edge (India) Ltd,Private Equity,"1,250,000"
900,43,28/07/2017,Gympik.com,Consumer Internet,online marketplace for discovering fitness centres,Bangalore,RoundGlass Partners,Seed Funding,N/A
901,44,,,,,,,,
902,1,02/03/2015,TrulyMadly.com,"Helion Venture Partners, Kae Capital",Private Equity,"5,500,000",Series A,,
903,2,02/03/2015,InstaLively,Group of Angel Investors,Seed Funding,"120,000",,,
904,3,03/03/2015,Vserv,"Maverick Capital, IDG Ventures India",Private Equity,"15,000,000",,,
905,4,03/03/2015,Intruo.com,"Ashutosh Lawania, Alok Goel & others",Seed Funding,N/A,,,
906,5,05/03/2015,Niffler,SAIF Partners,Seed Funding,"1,000,000",,,
907,6,05/03/2015,CustomFurnish.com,"Madhukar Gangadi, Satish Reddy, Srini Raju, Srini Koppolu & SIDBI",Private Equity,"2,500,000",,,
908,7,06/03/2015,MapMyGenome,Rajan Anandan & other angel investors,Private Equity,"1,200,000",,,
909,8,09/03/2015,Crowdfire (formerly Justunfollow),Kalaari Capital,Private Equity,"2,500,000",,,
910,9,09/03/2015,Bite Club,"Powai Lake Ventures, Aneesh Reddy, Ashish Kashyap, Alok Mittal",Seed Funding,"500,000",,,
911,10,10/03/2015,Localbanya,Shrem Strategies,Private Equity,N/A,Series B,,
912,11,11/03/2015,Appedo,Undisclosed Investors,Seed Funding,"1,000,000",,,
913,12,11/03/2015,Fitraq.com,Tarun Arora,Seed Funding,"150,000",,,
914,13,11/03/2015,ChargeBee,"Tiger Global, Accel Partners",Private Equity,"5,000,000",Series B,,
915,14,11/03/2015,Groupon India,Sequoia Capital,Private Equity,"20,000,000",,,
916,15,12/03/2015,Process 9,"IAN Ventures, Alok Sharma, Kris Gopalakrishnan, Saurabh Srivastava, Ajai Chowdhry",Seed Funding,N/A,,,
917,16,12/03/2015,MoonFrog Labs,"Tiger Global, Sequoia Capital.",Private Equity,"15,000,000",Series A,,
918,17,13/03/2015,Foodpanda,Rocket Internet AG & others,Private Equity,"110,000,000",Series C,,
919,18,13/03/2015,Paytm,Ratan Tata,Private Equity,N/A,More details,,
920,19,13/03/2015,DiabetOmics,"VentureEast,  Varaprasad Reddy",Private Equity,"5,000,000",Series C,,
921,20,13/03/2015,Qyk,"Powai Lake Ventures, Zishan Hayath, Abhishek Goyal, Sahil Barua",Seed Funding,N/A,,,
922,21,14/03/2015,Daily Rounds,"Kae Capital, GSF, Teruhide Sato",Seed Funding,"500,000",,,
923,22,14/03/2015,Orobind,"Zishaan Hayath, Lalit Mangal, Harpreet Singh Grover",Seed Funding,"200,000",,,
924,23,14/03/2015,Routofy,"Kunal Bahl, Rohit Bansal",Seed Funding,N/A,,,
925,24,16/03/2015,Digital Gorkha,Ramesh kavediya,Seed Funding,"166,000",,,
926,25,16/03/2015,NestAway,"IDG Ventures, Naveen Tewari",Seed Funding,"1,300,000",,,
927,26,16/03/2015,The Better India,I-cube-N,Seed Funding,"166,000",,,
928,27,16/03/2015,Meru Cabs,Value Fund Advisors,Private Equity,"50,000,000",,,
